{
	"$schema": "https://json-schema.org/draft/2020-12/schema",
	"$id": "https://cannectors.io/schemas/pipeline/v1.1.0/pipeline-schema.json",
	"title": "Cannectors Pipeline Configuration Schema",
	"description": "Schema for defining declarative modular pipeline configurations. Supports Input → Filter → Output pattern with extensible module types.",
	"type": "object",
	"required": ["name", "input", "output"],
	"properties": {
		"id": {
			"type": "string",
			"description": "Optional pipeline identifier. Defaults to name when omitted.",
			"pattern": "^[a-z][a-z0-9_-]*$"
		},
		"name": {
			"type": "string",
			"description": "Unique identifier for this connector.",
			"minLength": 1,
			"maxLength": 128
		},
		"version": {
			"type": "string",
			"description": "Connector version. Free-form non-empty string.",
			"minLength": 1
		},
		"description": {
			"type": "string",
			"maxLength": 1024
		},
		"tags": {
			"type": "array",
			"description": "User-facing tags. Accepted but ignored by the runtime.",
			"items": { "type": "string" },
			"uniqueItems": true
		},
		"enabled": {
			"type": "boolean",
			"description": "Whether the pipeline is active.",
			"default": true
		},
		"dryRunOptions": {
			"type": "object",
			"description": "Dry-run mode options.",
			"properties": {
				"showCredentials": {
					"type": "boolean",
					"description": "When true, dry-run shows resolved credentials instead of masked values.",
					"default": false
				}
			},
			"additionalProperties": false
		},
		"defaults": {
			"$ref": "common-schema.json#/$defs/moduleDefaults",
			"description": "Default settings for all modules. Module-level settings override these."
		},
		"input": {
			"$ref": "input-schema.json#/$defs/inputModule"
		},
		"filters": {
			"type": "array",
			"items": { "$ref": "filter-schema.json#/$defs/filterModule" }
		},
		"output": {
			"$ref": "output-schema.json#/$defs/outputModule"
		}
	},
	"additionalProperties": false
}
